{
  "request_id": "req-demo-001",
  "task_id": "task-demo-001",
  "timestamp": "2026-08-04T10:00:00Z",
  "subject": {
    "id": "user-001",
    "type": "user",
    "department": "综合办公室",
    "roles": ["office_user"],
    "clearance": 1,
    "mfa": true
  },
  "action": {
    "tool": "database.query",
    "operation": "query",
    "resource": "db://public/notices",
    "parameters": {"limit": 20, "item_count": 20},
    "risk_level": "low",
    "data_level": "internal"
  },
  "context": {
    "source": "mcp",
    "destination_zone": "internal",
    "enforcement_point": "gateway",
    "business_hours": true,
    "repeat_count": 0
  },
  "environment": {
    "sandbox": {"enabled": false, "profile": ""}
  },
  "approval": {}
}
